{
  "slug": "texture-and-light",
  "title": "Texture, light and colour.",
  "excerpt": "The same colour can feel entirely different on another texture. Pay attention to small changes in light when choosing a fabric.",
  "bodyMdx": [
    "The same colour can feel entirely different on another texture. Pay attention to small changes in light when choosing a fabric.",
    "## Look in daylight",
    "Examine your favourite fabric near a window. Notice how its colour changes between morning and evening.",
    "## Bring materials together",
    "Consider wood, wall colour and fabric side by side. Harmony does not always mean matching shades. It can come from the way different surfaces complement each other.",
    "<Callout>Get in touch to explore the fabric and sample options at our store.</Callout>"
  ],
  "seo": {
    "title": "Texture, light and colour. | Normod Cyprus",
    "description": "The same colour can feel entirely different on another texture. Pay attention to small changes in light when choosing a fabric."
  }
}
