{
  "slug": "doku-ve-isik",
  "title": "Doku, ışık ve renk.",
  "excerpt": "Aynı renk, farklı bir dokuda bambaşka görünebilir. Kumaş seçerken ışığın küçük değişimlerine de bak.",
  "bodyMdx": [
    "Aynı renk, farklı bir dokuda bambaşka görünebilir. Kumaş seçerken ışığın küçük değişimlerine de bak.",
    "## Gün ışığında bak",
    "Beğendiğin kumaşı pencere yakınında incele. Sabah ve akşam ışığında rengin nasıl değiştiğini gözlemle.",
    "<PhotoPair left=\"klem-three-2\" right=\"carle-three-2\" />",
    "## Malzemeleri yan yana getir",
    "Ahşap, duvar rengi ve kumaşı birlikte düşün. Uyum her zaman aynı tonları seçmek değildir; farklı yüzeylerin birbirine nasıl eşlik ettiğini görmek de önemlidir.",
    "<Callout>Mağazamıza yaz, ilgilendiğin kumaş ve numune seçeneklerini birlikte keşfedelim.</Callout>"
  ],
  "seo": {
    "title": "Doku, ışık ve renk. | Normod Kıbrıs",
    "description": "Aynı renk, farklı bir dokuda bambaşka görünebilir. Kumaş seçerken ışığın küçük değişimlerine de bak."
  }
}
