{
  "slug": "yasamak-icin-alan",
  "title": "Yaşamak için alan aç.",
  "excerpt": "Bir odayı yerleştirmeye mobilyalardan değil, içinde geçirdiğin anlardan başla.",
  "bodyMdx": [
    "Bir odayı yerleştirmeye mobilyalardan değil, içinde geçirdiğin anlardan başla.",
    "## Önce yolları düşün",
    "Kapıdan pencereye, koltuktan masaya uzanan yolları açık bırak. Böylece oda daha büyük görünmenin ötesinde, daha rahat kullanılır.",
    "<PhotoPair left=\"klem-three-1\" right=\"bedroom\" />",
    "## Kendine bir köşe ayır",
    "Okumak için gün ışığı alan bir yer ya da sohbet için birbirine dönük iki koltuk. Küçük bir yerleşim kararı, gündelik bir alışkanlığa alan açabilir.",
    "<Callout>Odanın ölçülerini ve birkaç fotoğrafını mağaza ziyaretine getir. Yerleşim seçeneklerini birlikte düşünelim.</Callout>"
  ],
  "seo": {
    "title": "Yaşamak için alan aç. | Normod Kıbrıs",
    "description": "Bir odayı yerleştirmeye mobilyalardan değil, içinde geçirdiğin anlardan başla."
  }
}
